{
  "$schema": "https://json-schema.org/draft/2020-12/schema",
  "$id": "https://spotify-jukebox.local/sdlc/schemas/task-packet.schema.json",
  "title": "sdlc-supervisor task packet",
  "description": "The entire scope contract handed from the orchestrator to an implementer for one task, per docs/sdlc/design-spec.md §5. Generated by scripts/sdlc/generate-task-packet.mjs into .sdlc/task-packets/<task_id>.packet.json. This replaces a vaguer 'list of files it should probably touch' -- read_paths/write_paths/forbidden_paths are the actual scope boundary an implementer (and, eventually, tooling around it) is expected to honor.",
  "type": "object",
  "required": [
    "task_id",
    "plan_revision",
    "objective",
    "non_goals",
    "dependencies",
    "read_paths",
    "write_paths",
    "forbidden_paths",
    "acceptance_criteria",
    "verification_commands",
    "expected_report",
    "max_attempts"
  ],
  "additionalProperties": false,
  "properties": {
    "task_id": {
      "type": "string",
      "minLength": 1,
      "description": "Task identifier, e.g. 'SS0.3'. Matches the id used in .sdlc/state.json's work_items[].tasks[]."
    },
    "plan_revision": {
      "type": "string",
      "minLength": 1,
      "description": "Identifies exactly which version of the source implementation-plan entry this packet was generated from, so a later plan edit doesn't silently invalidate an in-flight packet without anyone noticing. Convention chosen here: the short git commit SHA of the implementation-plan file at generation time if the repo is clean and the file is tracked/committed, otherwise the string 'uncommitted:<ISO-8601 generation timestamp>' as an honest fallback. Not required to be a git SHA by this schema -- any non-empty string identifying the plan revision is valid -- but the generator script documents and follows the convention above."
    },
    "objective": {
      "type": "string",
      "minLength": 1,
      "description": "What this task is trying to accomplish, in prose. Generated from the plan entry's own text (and design excerpt, if given), not re-derived."
    },
    "non_goals": {
      "type": "array",
      "items": { "type": "string" },
      "description": "Explicit call-outs of adjacent things this task should NOT do. May be empty if the source text doesn't state any -- the generator does not invent non-goals it can't ground in the input text."
    },
    "dependencies": {
      "type": "array",
      "items": { "type": "string", "minLength": 1 },
      "description": "Task IDs (matching other packets' task_id) that must be done before this one can start."
    },
    "read_paths": {
      "type": "array",
      "items": { "type": "string", "minLength": 1 },
      "description": "Path globs the implementer is expected to need to read. Inferred heuristically by the generator -- see the heuristic documented in scripts/sdlc/generate-task-packet.mjs's header comment. May contain the literal placeholder 'NEEDS_MANUAL_REVIEW' (as its own array entry) when nothing concrete could be inferred from the input text; a packet containing that placeholder is NOT actually ready to hand to an implementer and needs a human/orchestrator pass first."
    },
    "write_paths": {
      "type": "array",
      "items": { "type": "string", "minLength": 1 },
      "description": "Path globs the implementer is expected to need to create or modify. Same inference heuristic and NEEDS_MANUAL_REVIEW convention as read_paths."
    },
    "forbidden_paths": {
      "type": "array",
      "items": { "type": "string", "minLength": 1 },
      "description": "Path globs explicitly off-limits for this task even if they'd otherwise look related (e.g. a sibling in-flight task's files, or master-branch-only files like .sdlc/state.json itself). Not inferred from task text by the generator's heuristic -- populated from known always-forbidden repo paths plus anything the caller passes explicitly, since 'what NOT to touch' is exactly the kind of thing free text tends not to mention."
    },
    "acceptance_criteria": {
      "type": "array",
      "items": { "type": "string", "minLength": 1 },
      "description": "Human-readable pass/fail conditions this task must satisfy, taken from the plan entry's own acceptance-criteria text when present."
    },
    "verification_commands": {
      "type": "array",
      "items": { "type": "string", "minLength": 1 },
      "description": "Shell commands the implementer (or a verifier) should run to check the work, e.g. test/build/typecheck commands from docs/TESTING.md. May be empty if the source text names none -- the generator does not invent commands it can't ground in the input."
    },
    "expected_report": {
      "type": "string",
      "const": "docs/sdlc/schemas/completion-report.schema.json",
      "description": "Fixed pointer to the completion-report schema every implementer's report for this packet must validate against. A constant rather than free text, since there is exactly one report shape in this framework."
    },
    "max_attempts": {
      "type": "integer",
      "minimum": 1,
      "description": "Maximum number of attempts before this task escalates to the orchestrator instead of being retried automatically, per design-spec.md §7's run-budget concept. The generator defaults this from project.yaml's budgets.max_attempts_per_task when available, else a hardcoded fallback documented in the generator script."
    }
  }
}
